{
  "name": "dj-react-patterns",
  "version": "1.0.0",
  "owner": "team",
  "description": "React 19.2 patterns, Zustand state management, and frontend conventions for the DJ app",
  "categories": ["react", "zustand", "state-management", "sse", "css"],
  "applies_to": {"extensions": [".tsx", ".ts", ".css"]},
  "sensitive_paths": ["**/stores/**", "**/hooks/**", "**/features/**"],
  "excludes_paths": ["node_modules/", "dist/", "workers/", "marvel/"],
  "depends_on": ["code-quality"],
  "references": {
    "code_paths": ["apps/web/src/stores/", "apps/web/src/hooks/", "apps/web/src/features/", "apps/web/src/lib/"],
    "doc_links": []
  }
}
