{
  "name": "dj-experience",
  "version": "1.0.0",
  "owner": "team",
  "description": "Auto DJ experience design patterns, Opus 4.6 DJ brain architecture, narration voice, progressive disclosure, and playback-first UX",
  "categories": ["ux", "dj", "narration", "experience", "progressive-disclosure"],
  "applies_to": {"extensions": [".tsx", ".ts", ".css"]},
  "sensitive_paths": [
    "**/features/dj/**",
    "**/stores/djStore**",
    "**/dj-narrator**",
    "**/player-stream**",
    "**/set-planner**",
    "**/skip-analyzer**"
  ],
  "excludes_paths": ["node_modules/", "dist/", "marvel/"],
  "depends_on": ["dj-react-patterns", "dj-llm-tools", "dj-set-planning"],
  "references": {
    "code_paths": [
      "apps/web/src/features/dj/",
      "apps/web/src/stores/djStore.ts",
      "workers/api/src/lib/dj-narrator.ts",
      "workers/api/src/lib/set-planner.ts",
      "workers/api/src/routes/player-stream.ts"
    ],
    "doc_links": [
      "https://dj.studio/blog/anatomy-great-dj-mix-structure-energy-flow-transition-logic",
      "https://newsroom.spotify.com/2025-05-13/dj-voice-requests/"
    ]
  }
}
