{
  "name": "dj-spotify-integration",
  "version": "1.0.0",
  "owner": "team",
  "description": "Spotify API patterns, OAuth tokens, playlist/playback tools, queue management, and data enrichment",
  "categories": ["spotify", "oauth", "playback", "enrichment", "deezer", "lastfm"],
  "applies_to": {"extensions": [".ts", ".tsx"]},
  "sensitive_paths": ["**/spotify**", "**/player**", "**/playback**", "**/auth**", "**/mix**", "**/enrichment**"],
  "excludes_paths": ["node_modules/", "dist/", "marvel/"],
  "depends_on": ["security"],
  "references": {
    "code_paths": [
      "workers/api/src/routes/chat-stream/tools/",
      "workers/api/src/services/",
      "workers/api/src/routes/player-stream.ts",
      "apps/web/src/stores/playbackStore.ts"
    ],
    "doc_links": []
  }
}
