{
  "name": "dj-cloudflare-workers",
  "version": "1.0.0",
  "owner": "team",
  "description": "Cloudflare Workers patterns, Hono routing, SSE streaming, KV storage, and rate limiting",
  "categories": ["cloudflare", "workers", "hono", "sse", "kv", "rate-limiting"],
  "applies_to": {"extensions": [".ts"]},
  "sensitive_paths": ["**/workers/**", "**/routes/**", "wrangler.jsonc"],
  "excludes_paths": ["node_modules/", "dist/", "apps/web/", "marvel/"],
  "depends_on": ["security"],
  "references": {
    "code_paths": ["workers/api/src/", "workers/api/src/routes/", "workers/api/src/utils/"],
    "doc_links": []
  }
}
