{
  "name": "dj-monorepo",
  "version": "1.0.0",
  "owner": "team",
  "description": "pnpm monorepo conventions, build order, workspace dependencies, deployment, and shared packages",
  "categories": ["monorepo", "pnpm", "build", "deployment", "typescript"],
  "applies_to": {"extensions": [".ts", ".tsx", ".json", ".jsonc"]},
  "sensitive_paths": [
    "package.json",
    "pnpm-workspace.yaml",
    "wrangler.jsonc",
    "tsconfig.json",
    "tsup.config.ts",
    ".github/**"
  ],
  "excludes_paths": ["node_modules/", "dist/", "marvel/"],
  "references": {
    "code_paths": [
      "package.json",
      "pnpm-workspace.yaml",
      "packages/shared-types/",
      "packages/api-client/",
      "packages/api-contracts/",
      "scripts/"
    ],
    "doc_links": []
  }
}
